{
  "v": 1,
  "source": "fixture",
  "window": {
    "process": "fixture-webapp",
    "title": "Operant Fixture Invoices",
    "monitor": "MON1",
    "dpi_scale": 1.0
  },
  "digest": "b1b1b1b1b1b1b1b1b1b1b1b1b1b1b1b1b1b1b1b1b1b1b1b1b1b1b1b1b1b1b1b1",
  "truncated": false,
  "elements": [
    {
      "idx": 0,
      "parent": null,
      "role": "document",
      "name": "Operant Fixture Invoices",
      "value": null,
      "automation_id": null,
      "bounds": { "x": 0, "y": 0, "w": 1024, "h": 768, "monitor": "MON1" },
      "enabled": true,
      "offscreen": false,
      "is_password": false,
      "patterns": [],
      "selectors": [
        { "kind": "name_role_path", "path": [{ "role": "document", "name": "Operant Fixture Invoices" }] }
      ]
    },
    {
      "idx": 1,
      "parent": 0,
      "role": "edit",
      "name": "Customer",
      "value": "",
      "automation_id": "customer",
      "bounds": { "x": 40, "y": 120, "w": 300, "h": 32, "monitor": "MON1" },
      "enabled": true,
      "offscreen": false,
      "is_password": false,
      "patterns": ["value"],
      "selectors": [
        { "kind": "automation_id", "value": "customer" },
        { "kind": "css", "value": "#customer" },
        { "kind": "name_role_path", "path": [{ "role": "document", "name": "Operant Fixture Invoices" }, { "role": "edit", "name": "Customer" }] }
      ]
    },
    {
      "idx": 2,
      "parent": 0,
      "role": "edit",
      "name": "Amount",
      "value": "",
      "automation_id": "amount",
      "bounds": { "x": 40, "y": 170, "w": 300, "h": 32, "monitor": "MON1" },
      "enabled": true,
      "offscreen": false,
      "is_password": false,
      "patterns": ["value"],
      "selectors": [
        { "kind": "automation_id", "value": "amount" },
        { "kind": "css", "value": "#amount" },
        { "kind": "name_role_path", "path": [{ "role": "document", "name": "Operant Fixture Invoices" }, { "role": "edit", "name": "Amount" }] }
      ]
    },
    {
      "idx": 3,
      "parent": 0,
      "role": "button",
      "name": "Store invoice",
      "value": null,
      "automation_id": "store-btn",
      "bounds": { "x": 40, "y": 220, "w": 140, "h": 36, "monitor": "MON1" },
      "enabled": true,
      "offscreen": false,
      "is_password": false,
      "patterns": ["invoke"],
      "selectors": [
        { "kind": "automation_id", "value": "store-btn" },
        { "kind": "css", "value": "#store-btn" },
        { "kind": "name_role_path", "path": [{ "role": "document", "name": "Operant Fixture Invoices" }, { "role": "button", "name": "Store invoice" }] },
        { "kind": "ordinal_path", "path": [{ "role": "document", "ordinal": 0 }, { "role": "button", "ordinal": 0 }] }
      ]
    },
    {
      "idx": 4,
      "parent": 0,
      "role": "list",
      "name": "Saved invoices",
      "value": null,
      "automation_id": "invoice-list",
      "bounds": { "x": 40, "y": 290, "w": 500, "h": 300, "monitor": "MON1" },
      "enabled": true,
      "offscreen": false,
      "is_password": false,
      "patterns": [],
      "selectors": [
        { "kind": "automation_id", "value": "invoice-list" },
        { "kind": "css", "value": "#invoice-list" },
        { "kind": "name_role_path", "path": [{ "role": "document", "name": "Operant Fixture Invoices" }, { "role": "list", "name": "Saved invoices" }] }
      ]
    }
  ]
}
